Team,Opponent Team,Date,Site,Incident,Time,VARused,DecisionType,
Sheffield United,Manchester City,Dec. 29,A,Goal for Lys Mousset ruled out for offside,29th minute,AGAINST,Goal ruled out,
Sheffield United,West Ham,Jan. 10,H,Goal for Robert Snodgrass ruled out for handball in the build-up by Declan Rice,90th minute,FOR,Goal ruled out,
Sheffield United,Crystal Palace,Feb. 1,A,Red card for Joel Ward rescinded,74th minute,AGAINST,Red Card cancelled,
Sheffield United,Tottenham,Jul-02,H,Goal for Harry Kane ruled out for handball in the build-up by Lucas Moura,32nd minute,FOR,Goal ruled out,
Wolves,Leicester,Aug. 11,A,Wolves goal for Leander Dendoncker disallowed for handball in build-up by Willy Boly,51st minute,AGAINST,Goal ruled out,
Wolves,Southampton,Oct. 19,H,Raul Jimenez goal ruled out for offside against Patrick Cutrone,42nd minute,AGAINST,Goal ruled out,
Wolves,Man City,Dec. 27,H,Penalty awarded (missed by Raheem Sterling) for foul on Riyad Mahrez by Leander Dendoncker,21st minute,AGAINST,PK Awarded,
Wolves,Man City,Dec. 27,H,Missed City penalty retaken due to encroachment by Connor Coady . Retake scored by on rebound by Raheem Sterling,25th minute,AGAINST,PK Retaken,
Wolves,Liverpool,Dec. 29,A,Goal for Sadio Mane given after originally ruled out for handball by Adam Lallana,42nd minute,AGAINST,Goal allowed,
Wolves,Liverpool,Dec. 29,A,Goal for Pedro Neto ruled out for offside in the build-up by Jonny,45th minute,AGAINST,Goal ruled out,
Wolves,Watford,Jan. 1,A,Christian Kabasele sent off for professional foul after originally being booked,68th minute,FOR,Red Card,
Wolves,Southampton,Jan. 18,A,Penalty awarded (scored by Raul Jimenez) for foul on Jonny by Jack Stephens,65th minute,FOR,PK Awarded,
Wolves,Leicester,Feb. 14,A,Wolves goal for Willy Boly disallowed for offside in build-up by Pedro Neto,44th minute,AGAINST,Goal ruled out,
Norwich City,Chelsea,Aug. 24,H,Chelsea goal for Kurt Zouma disallowed for a foul on the goalkeeper by Olivier Giroud,77th minute,FOR,Goal ruled out,
Norwich City,Man United,Oct. 27,H,Penalty awarded (missed by Marcus Rashford) for foul on Daniel James by Ben Godfrey,25th minute,AGAINST,PK Awarded,
Norwich City,Man United,Oct. 27,H,Penalty awarded (missed by Anthony Martial) for handball by Todd Cantwell,41st minute,AGAINST,PK Awarded,
Norwich City,Arsenal,Dec. 1,H,Pierre-Emerick Aubameyang missed penalty retaken (and scored) following encroachment by a defender,29th minute,AGAINST,PK Retaken,
Norwich City,Sheffield United,Dec. 8,H,Red card for Chris Basham rescinded,74th minute,AGAINST,Red Card,
Norwich City,Tottenham,Dec. 28,H,Teemu Pukki goal ruled out for offside,33rd minute,AGAINST,Goal ruled out,
Norwich City,Crystal Palace,Jan. 1,H,Connor Wickham goal awarded after originally being ruled out for offside,85th minute,AGAINST,Goal ruled out,
Norwich City,Bournemouth,Jan. 18,H,Red card for Ben Godfrey for foul on Callum Wilson,76th minute,AGAINST,Red Card,
Norwich City,Leicester,Feb. 28,H,Goal for Kelechi Iheanacho disallowed for handball,49th minute,FOR,Goal ruled out,
Norwich City,Burnley,Jul-18,H,Red card for Emiliano Buendia for an elbow on Ashley Westwood,33rd minute,AGAINST,Red Card,
Norwich City,Man City,Jul-26,A,Goal for Onel Hernandez ruled out for offside,7th minute,AGAINST,Goal ruled out,
